<?xml version="1.0" encoding="UTF-8"?>
<!--
  Document   : Locale-FR
  Description: Application Locales
-->

<!--$Id$-->

<locales xmlns:xsi="http://www.w3.org/2001/XMLSchema-instance" xsi:noNamespaceSchemaLocation="https://aweframework.gitlab.io/awe/docs/schemas/locale.xsd">
  <locale name="BUTTON_LOAD" value="Charge"/>
  <locale name="BUTTON_SAVE" value="Enregistrer"/>
  <locale name="DATABASE_MESSAGE_RESPONSE_OK" value="L&apos;opération a été couronnée de succès"/>
  <locale name="DATABASE_MESSAGE_TITLE" value="Base de données de messages"/>
  <locale name="ERROR_MESSAGE_BUILD_COLUMNS" value="Erreur lors de la création des colonnes"/>
  <locale name="ERROR_MESSAGE_PERMISION_DENIED" value="Vous avez pas l&apos;autorisation d&apos;effectuer cette action"/>
  <locale name="ERROR_MESSAGE_PRINTING" value="Erreur lors de l&apos;impression"/>
  <locale name="ERROR_MESSAGE_SELECT_RUN" value="Échoué à exécuter l&apos;instruction SQL"/>
  <locale name="ERROR_MESSAGE_SESSION_EXPIRED" value="Votre connexion a expiré. Vous connecter à nouveau s&apos;il vous plaît."/>
  <locale name="ERROR_MESSAGE_SQL" value="Erreur Sql"/>
  <locale name="ERROR_MESSAGE_WRITING_SELECTS" value="Erreur lors de l&apos;écriture les clauses SELECT"/>
  <locale name="ERROR_TITLE_BUILD_COLUMNS" value="Erreur de colonne"/>
  <locale name="ERROR_TITLE_PRINTING" value="Erreur d&apos;impression"/>
  <locale name="ERROR_TITLE_SESSION_EXPIRED" value="Session expirée"/>
  <locale name="ERROR_TITLE_WRITING_SELECTS" value="Erreur SQL"/>
  <locale name="HELP_LOAD_BUTTON" value="Cliquez ici pour charger des instructions SQL à partir d&apos;un fichier"/>
  <locale name="HELP_SAVE_BUTTON" value="Cliquez ici pour enregistrer des instructions SQL dans un fichier"/>
  <locale name="MENU_FILE_MANAGER" value="Gestionnaire de fichiers"/>
  <locale name="PARAMETER_DATABASE" value="La base de données"/>
  <locale name="PARAMETER_FILE" value="Fichier"/>
  <locale name="PARAMETER_SAVE_FILE" value="Nom de fichier"/>
  <locale name="SCREEN_TITLE_LOAD_SELECT" value="Charge de sélectionner"/>
  <locale name="SCREEN_TITLE_SAVE_SELECT" value="Sélectionnez enregistrer"/>
  <locale name="SCREEN_TITLE_SQL_EXTRACTOR" value="SQL Extracteur"/>
  <locale name="WARNING_MESSAGE_DUPLICATED_FILE" value="Un fichier avec ce nom existe déjà. Voulez-vous le remplacer?"/>
  <locale name="WARNING_TITLE_DUPLICATED_FILE" value="Dupliqué"/>
</locales>